{
  "lastName": "",
  "firstName": "",
  "midInitials": "",
  "email": "",
  "phone": "",
  "fax": "",
  "address": "",
  "affiliations": [
    {
      "name": "",
      "id": ""
    }
  ],
  "roles": [
    {
      "role": "",
      "ontologyAnnotation": {
        "name": "",
        "termSource": "",
        "termAccession": ""
      },
      "id": ""
    }
  ]
}




